-00:00:15|<a name="f1start"></a>At T minus 8.9 seconds, a signal from the automatic sequencer fires four pyrotechnic devices. Two initiate combustion within the gas generator while another two cause the fuel-rich turbine exhaust gas to ignite when it enters the engine bell. Links are burned away by these igniters to generate an electrical signal to move the start solenoid. The start solenoid directs hydraulic pressure from the ground supply to open the main LOX valves. LOX begins to flow through the LOX pump, starting it to rotate, then into the combustion chamber. The opening of both LOX valves also causes a valve to allow fuel and LOX into the gas generator, where they ignite and accelerate the turbine. Fuel and LOX pressures rise as the turbine gains speed. The fuel-rich exhaust from the gas generator ignites in the engine bell to prevent backfiring and burping of the engine. The increasing pressure in the fuel lines opens a valve, the igniter fuel valve, letting fuel pressure reach the hypergolic cartridge which promptly ruptures. Hypergolic fluid, followed by fuel, enters the chamber through its port where it spontaneously ignites on contact with the LOX already in the chamber.
-00:00:15|Rising combustion-induced pressure on the injector plate actuates the ignition monitor valve, directing hydraulic fluid to open the main fuel valves. These are the valves in the fuel lines between the turbopump and the injector plate. The fuel flushes out ethylene glycol which had been preloaded into the cooling pipework around the combustion chamber and nozzle. The heavy load of ethylene glycol mixed with the first injection of fuel slows the buildup of thrust, giving a gentler start. Fluid pressure through calibrated orifices completes the opening of the fuel valves and fuel enters the combustion chamber where it burns in the already flaming gases. The exact time that the main fuel valves open is sequenced across the five engines to spread the rise in applied force that the structure of the rocket must withstand.
-00:00:05|As fuel and LOX flow increase to maximum, the rise in chamber pressure, and therefore thrust, is monitored to confirm that the required force has been achieved. With the turbopump at full speed, fuel pressure exceeds hydraulic pressure supplied from ground equipment. Check valves switch the engine's hydraulic supply to be fed from the rocket's fuel instead of from the ground.
-00:00:02|At lift-off, one of the most important areas of the main display console that the commander must monitor is the subpanel which annunciates the progress of the launch. From top to bottom, this subpanel contains the Abort light, Mission Event Timer, Launch Vehicle Engine lights, lift-off light and critical switches (with safety covers) that are used to override the automatic abort sequences.
000:00:00|The stack is held onto the pad two ways. Four hold-down arms clamp the base of the S-IC, each with a force of 350 tonnes, anchoring the vehicle until full thrust is confirmed. A pneumatic device, backed up by an explosive, collapses the lever linkage to allow the arm to rise. Additionally, a number of controlled-release mechanisms (up to 16, depending on the mission) prevent the vehicle from accelerating too rapidly in the first moments of motion. These consist of tapered pins mounted to the pad which are pulled through dies mounted on the vehicle. The deformation of the pins controls the initial acceleration for the first 150 mm of flight; a simple and ingenious arrangement.
000:00:00|With lift off, the crew move to <a href="https://history.nasa.gov/afj/ap16fj/csmlc\csmlc.html#Page2-7" target="afj">Page 2-7</a> of the Launch Checklist, and <a href="https://history.nasa.gov/afj/ap16fj/aoh_op_procs.html#Boost" target="afj">Page 4-55</a> of the Operational Procedures.
000:00:00|Once the launch vehicle begins to rise, even fractionally, it cannot safely settle back onto the pad. Intentional engine shutdown will not occur, so of the nine access arms, the five which have remained attached up to this point, must now detach their umbilicals from the vehicle and swing clear. The first two centimetres of travel trigger the release of the umbilical connector plates which in turn triggers retraction of the arms.
000:00:06|On this, and all Saturn V launches, the stack can easily be seen leaning away from the LUT as it ascends from the launch pad. This yaw, begun 1.35 seconds after lift-off, maneuvers the vehicle 1.25&deg; from vertical in a direction away from the tower to ensure clearance in case a gust of wind pushes it back or a swing arm doesn't fully retract. Then nine seconds into the flight, almost as the rising rocket clears the tower, the stack is brought vertical again. To those who were not prepared for it, this fully intended yawing of over 110 metres of metal, filled to the brim with exotic fuels and oxidizers, could sometimes cause some consternation. The astronauts were also very aware that any guidance or engine steering control failure could cause a collision with the tower which would probably not have been survivable even with the Launch Escape System. On Apollo 16 there is minor anomaly in the maneuver, which is completed about 1 second late. This is due to a software glitch in the launch vehicle guidance system located in the Instrument Unit. Although not a major fault, it could have decreased the clearance from the tower and the IU computer will be reprogrammed for the Apollo 17 and Skylab launches.
000:00:12|Once the stack is clear of the tower, control of the mission switches from the Launch Control Center (LCC) at the Cape under the Launch Director, to the Mission Control Center (MCC) in Houston where the Flight Director is in charge.
000:00:21|The guidance of the launch vehicleis monitored and controlled by the Launch Vehicle Digital Computer in the IU and its programs, and not by the CM Guidance and Control System, which only monitors for now. The Pitch Program rolled and pitched the launch vehicle from its 90° east of north launch azimuth (fixed by the launch pad design) to the correct azimuth and elevation for its ascent to orbit (72.034° east of north for Apollo 16). The CM's guidance system was used by the crew to provide an independent monitoring function, using the Command Module Computer's (CMC's) Program 11 (P11). The maximum pitch and yaw limits were 4° per second, and roll 11° per second. These were not bad given the size and mass of a fully loaded Saturn V! In extremis, the CM guidance system could be used to command the Saturn V, and there were numerous arguments among the astronauts on the feasibility of manually flying the Saturn V into orbit.
000:00:21|The CMC (Command Module Computer)is closely involved in computation of the spacecraft's trajectory throughout the flight though, during launch, the IU handles trajectory computation and vehicle control. The CMC is accessed by the crew via two DSKYs (Display and Keyboard), one of which is on the main instrument panel, the other being on the LEB (Lower Equipment Bay). The LM carries a computer of very similar design. The CMC contains a series of numbered Programs, which the crew control by entering numbers referred to as Verbs and Nouns. See the essay <a href="https://history.nasa.gov/afj/ap16fj/../compessay.html" target="afj">The Apollo On-board Computers</a> by Phill Parker.
000:00:21|Dave Scott, Commander of Apollo 15, from 1998 correspondence - "The CMC computed the entire launch profile such that if the IU failed (at any time) the entire Saturn V, or subsequent stages, could be flown into orbit manually by using primarily the FDAI (Flight Director Attitude Indicator) and DSKY (Display-Keyboard) displays and one of the two RHCs (Rotational Hand Controllers). This is a little-known, but very important capability; and we spent a fair amount of time training for this. The DSKY display also provided a monitor of the IU performance, and if deviations were too large, the THC (Translation Hand Controller) could be used to disengage the IU completely and proceed with a manual launch insertion. Again, a very important 'abort-type' capability.
000:00:21|The FDAI is the critical "flying" instrument in the CM. Also referred to as the '8-Ball' from its colouring, the FDAI is similar to the ball-style artificial horizon found on many aircraft and, likewise, allows determination of the spacecraft's attitude with respect to a desired frame of reference. Usually this will be the IMU (Inertial Measurement Unit) though it may be the GDC (Gyro Display Coupler), a device which displays the spacecraft's attitude compared to a crew preselected attitude. The FDAI will also show attitude errors and the rates of change of attitude.
000:00:22|Tom Mattingly from 1972 technical debriefing - "I didn't sense lift-off, except for the lights. I didn't sense the (roll) program. To me it was just like the fixed-base simulator with the vibration on top of it.
000:00:22|A fixed-base simulator is one which does not move to simulate flight. The Apollo simulators are almost all of the fixed-base type, apart from those used to simulate docking maneuvers. While restricted in fidelity, they are fine for training the crew on operation of the spacecraft systems.
000:00:24|Charlie Duke from 1972 technical debriefing - "It is like an elevator slowly lifting off. But, at ignition I had the lateral frequency of something or other. It just kept shaking at the same frequency throughout the whole S-IC burn. You felt yourself going faster and faster. I had the feeling it was a runaway freight train on a crooked track, swaying from side to side. That was all the way through the first stage."]</p> [Charlie Duke is not the first crewman to make this comparison. Bill Anders made a very similar remark about his ride aboard <i>Apollo 8's</i> launch vehicle.
000:00:24|The four outer F-1 engines are gimballing to control the rocket's attitude, causing rotation around its centre of gravity. Since most of the vehicle's mass, the fuel and LOX of the first stage, is currently concentrated towards its base, the crew find themselves at the long end of a long see-saw and feel the side-to-side motions strongly.
000:00:48|The aerodynamic forces acting on the launch vehicle have been rising as the vehicle gains speed. However, the air around it is thinning rapidly with its increasing altitude. The interaction of these two changing values will result in a maximum degree of pressure on the vehicle's skin at 1 minute, 26 seconds into the flight; at a speed of about Mach 1.7 and an altitude of 14.3 km. This moment of maximum dynamic pressure is also often described as "Max q" since "q" is the engineering term for dynamic pressure (which is a product of speed and atmospheric density).
000:00:57|See comments on spacecraft atmosphere earlier. If there had been no reduction in cabin pressure by 25,000 ft altitude, Charlie Duke would have activated the right hand Cabin Pressure Relief valve to manually dump air pressure and avoid over-pressurizing the spacecraft. This was one of the major reasons for the crew wearing full space suits during launch. The valve would have been closed manually once cabin pressure fell to 8 psi.
000:01:04|Throughout the powered ascent of the launch vehicle, there are various modes of aborting the mission, each of which are appropriate to the current height and speed. For the first two of these modes, IA and IB, the Flight Plan defines the safe range of vehicle motion rates as not exceeding ±4° per second in pitch and yaw, ±20° per second in roll. Motion rates exceeding these limits will entail an abort.
000:01:04|The initial 42 seconds, to an altitude of about 3,000 metres (10,000 feet) are flown in abort Mode IA (One Alpha). If a dangerous situation occurs within this period, the CM would separate from the SM, and the LET (Launch Escape Tower, or just 'tower'), which is the solid-fuelled rocket mounted on top of the CM, would carry it up from the wayward launch vehicle while a small 'pitch control' motor at the top of the LET steers the assembly east out over the ocean and away from a possibly exploding booster below. The tower would be jettisoned only 14 seconds after the initiation of the abort. While this is going on, the highly dangerous hypergolic propellants of the Command Module's RCS would quickly and automatically be dumped overboard as they would be harmful to the recovery forces. The CM would then descend on parachutes to a normal splashdown. The Mode IA Abort Procedures are on <a href="https://history.nasa.gov/afj/ap16fj/csmlc\csmlc.html#Section4" target="afj">Page 4-1</a> of the Launch Checklist
000:01:04|Abort Mode IB extends from 42 seconds into the flight to an altitude of 30.5 km (16.5 nautical miles) as defined by the abort checklist. With the vehicle being further downrange and tilted over, the pitch control motor would not be required in the event of a IB abort. However, it had been discovered during hypersonic testing, that the CM/LET stack could be aerodynamically stable in a tower-first as well as a base-first attitude so a pair of canards were added which would be deployed automatically to force the combination into an attitude where the base of the CM is facing the direction of travel, ready for the safe deployment of the drogue and main parachutes. While the canards have little effect in a low altitude abort, they become increasingly important as the Saturn V gains speed through the IB mode. The Mode IB Abort Procedures are on <a href="https://history.nasa.gov/afj/ap16fj/csmlc\csmlc.html#Section4" target="afj">Page 4-1</a> of the Launch Checklist.
000:01:06|Feet wet" is the US Naval aviator radio call for flight over the coast from land to sea. Young and Mattingly are both US Navy officers, Duke is USAF as is Gordon Fullerton.
000:01:17|There is no obvious reason for the Master Alarm. However, it is clear that the crew is not fazed by it.
000:02:00|Mode IC is used for aborts occurring between 30.5 km (16.5 nautical miles) and the jettison of the tower. As the air is now very thin, the airflow around the pair of canards at the top of the tower would have little aerodynamic effect during an abort. Instead, the tower and BPC would be jettisoned and the Command Module's RCS used to control the orientation of the spacecraft. The safe range of vehicle motion rates are now defined as not exceeding &plusmn;9&deg; per second in pitch and yaw, &plusmn;20&deg; per second in roll. The Mode IC Abort Procedures are on <a href="https://history.nasa.gov/afj/ap16fj/csmlc\csmlc.html#Section4" target="afj">Page 4-2</a> of the Launch Checklist.
000:02:00|The crew now move to <a href="https://history.nasa.gov/afj/ap16fj/csmlc\csmlc.html#Page2-8" target="afj">Page 2-8</a> of the Launch Checklist, and are on <a href="https://history.nasa.gov/afj/ap16fj/aoh_op_procs.html#Boost" target="afj">Page 4-59</a> of the Operational Procedures.
000:02:08|As the S-IC nears the end of its burn, Ken Mattingly is inhibiting the EDS with a switch directly below the computer keypad. The EDS is only needed for flight through the thickest part of the atmosphere where high aerodynamic forces and the structural load they impart to the vehicle could cause loss of control to turn catastrophic too quickly for the crew to react in time. With EDS switched off, any required aborts must be initiated by the crew, giving them more control.
000:02:22|Towards the end of the S-IC's boost phase, two factors serve to gradually increase the acceleration experienced onboard. First, the atmosphere is becoming essentially a vacuum, reducing the backpressure the exhaust gases have to fight against compared to the air pressure at sea level. This improves the efficiency of the engines so that from launch to cut-off, S-IC thrust rises 19% from 34,250 kN to about 40,700 kN. Second, the S-IC tanks are emptying, lightening the launch vehicle and presenting less inertia to the thrust. To alleviate these rising acceleration forces and the shock of all five engines shutting down simultaneously, the centre engine of the cluster is shut down 23.5 seconds earlier than the outboard engines. The outboard engines cutoff at 2:39.6, staging occurs at 2:40.7 and the second stage ignition command is at 2:41.8. The main reduction in thrust from full power on 4 engines to virtually zero will take less than 0.8 seconds.
000:02:22|Another effect of the reduced air pressure on the S-IC is visible on movie coverage of the launch as the base of the vehicle appears to be progressively consumed by the conflagration. Near the ground, the plume is constrained by air pressure into a narrow flame extending rearwards. With decreasing air pressure, the hot gases are able to expand into an ever widening plume. Towards the end of the S-IC's flight, the air is so thin and the slipstream so negligible that a small amount of exhaust is able to expand forwards up the side of the rocket's structure giving the appearance, on TV coverage, of the rocket's base being consumed by the plume.
000:02:48|Duke from the 1972 technical debrief - "I was surprised with [sic] the debris that I caught out of my left eye as it came by the hatch window from the staging.
000:02:49|<a name="j2desc"></a>The S-II stage carries five J-2 uprated engines which burn LH<sub>2</sub> and LOX to produce up to 1,041 kN (234,000 pounds) thrust each. They are capable of being restarted in flight but this feature is only implemented in the engine used in the S-IVB.
000:02:49|The thrust chamber and bell of each engine is fabricated from stainless steel tubes brazed together in a single unit. Supercold LH<sub>2</sub> is pumped through these tubes to cool the thrust chamber and simultaneously prewarm the fuel. The engine carries two separate turbopumps, both powered in turn by the exhaust from a gas generator which burns the stage's main propellants. The hot exhaust gas is fed from the gas generator, first to the fuel turbopump, then to the LOX turbopump before being routed to a heat exchanger and finally into the engine bell. The fuel and LOX outputs of both turbopumps are fed, via main control valves, to the thrust chamber injector via the LOX dome. Unlike the solid steel injector of the F-1, the J-2 injector is fabricated from layers of stainless steel mesh sintered into a single porous unit. A solid LOX injector behind this carries 614 posts which pass LOX through the injector and into the combustion chamber. Each post has a concentric fuel orifice around it and these orifices are attached to the porous injector. The fuel delivery is arranged to ensure that about 5 percent seeps through the injector face to cool it, the rest passing through the annular orifices.
000:02:49|The ASI (Augmented Spark Igniter), fed with propellant and mounted to the injector face, provides a flame to initiate full combustion. Valves are provided to bleed propellant through the supply system well before ignition to chill all components to their operating temperatures otherwise gas would be formed which would interfere with the engine's use of propellant as a lubricant in the turbopump bearings. A tank of gaseous helium is fabricated within a larger tank of gaseous hydrogen. This is the Start Tank. The helium provides control pressure for the engine's valves while the hydrogen spins up the turbopumps before the gas generator is ignited. A PU (Propellant Utilization) valve on the output of the LOX turbopump can open to reduce the LOX flowrate. This adjusts engine thrust down to 890 kN (200,000 pounds) during flight to optimise engine performance.
000:02:49|<a name="j2start"></a>To start the J-2 engine, spark plugs in the ASI and gas generator are energised. The Helium Control and Ignition Phase valves are actuated. Helium pressure closes the Propellant Bleed valves, it purges the LOX dome and other parts of the engine. The Main Fuel valve and the ASI Oxidiser valves are opened. Flame from the ASI enters the thrust chamber while fuel begins to circulate through its walls under pressure from the fuel tank. After a delay to allow the thrust chamber walls to become conditioned to the chill of the fuel, the Start Tank is discharged through the turbines to spin them up. This delay depends on the role of the engine. A one second delay is used for the S-II engines. Half a second later, the Mainstage Control Solenoid begins the major sequence of the engine start. It opens the control valve of the gas generator where combustion begins and the exhaust supplies power for the turbopumps. The Main Oxidiser valve is opened 14° allowing LOX to begin burning with the fuel which has been circulating through the chamber walls. A valve which has been allowing the gas generator exhaust to bypass the LOX turbopump is closed allowing its turbine to build up to full speed. Finally, the pressure holding the Main Fuel valve at 14° is allowed to bleed away and the valve gradually opens, building the engine up to its rated thrust.
000:02:51|The Apollo 16 mission is the eleventh flight of the Saturn V and the ninth manned launch of the booster. While the Apollo 16 launch vehicle configuration is essentially the same as that for Apollo 15, there have been continual small changes in configuration both to save weight and to fix problems. In many respects the Saturn V and Apollo spacecraft will remain experimental vehicles throughout their careers. The main change on AS-511 is the restoration of 4 retro-rockets to the S-IC stage to reduce the risk of collision between the first and second stages during separation. Until AS-510, 8 retrorockets were fitted in the outboard engine fairings and provided a total of 86,600 lbs force for 2/3 sec to help increase separation before ignition of the S-II's engines. The retrorockets are modified solid state Recruit rockets developed for the X-17 rocket used to test missile warheads in the 1950s and subsequently used for sounding rocket applications. Four were deleted from AS-510 as part of the weight savings to permit the carriage of the extra weight of the J-Mission spacecraft. In the event, separation distances during staging on Apollo 15 proved marginal and concern that failure of one retrorocket of the 4 could lead to the stages colliding has led to the return to 8 retrorockets on Apollo 16.
000:03:02|Mattingly is commenting that he had not seen the 5 lights come on to indicate the S-II engines have ignited. This should have happened at 02 44.
000:03:02|The lights go out again once each engine has reached 65 percent of rated thrust.
000:03:15|Once all five engines are firing, the explosive cord to cut the interstage ("skirt") between the S-I and the S-II is also armed. There will be a delay of 24 seconds after second stage engine start before the interstage is jettisoned. This ensures that the attitude of the vehicle has stabilized before the almost 10-metre-wide by 9-metre-long interstage falls away past the J-2 engines.
000:03:27|The LES consists of the tower, with all its rocket motors, instrumentation and canards; and the BPC (Boost Protective Cover), which is a shroud over the entire Command Module which protects the spacecraft from the friction generated heat of ascent, and from the exhaust of the Launch Escape Motor should the tower be used for an abort. The BPC includes two windows to allow visibility through the left hand and central windows of the CM. The central window is mounted in the main hatch of the CM. Only when the LES is jettisoned are the other three windows uncovered.
000:03:27|The main rocket motor of the LES, if used, would burn for eight seconds, generating 654 kN (147,000 pounds) through four nozzles which are angled to direct the exhaust away from the CM.
000:03:27|Abort Mode II lasts from the jettisoning of the tower to the decision to stage from the S-II to the S-IVB. In a Mode II abort, the Command and the Service Modules will separate from the launch vehicle and the SM main engine or its RCS engines will be used to get the spacecraft away from the launch vehicle. Then the CM and SM will separate before the CM completes a normal splashdown on the ocean. The Mode II Abort Procedures are on <a href="https://history.nasa.gov/afj/ap16fj/csmlc\csmlc.html#Section4" target="afj">Page 4-3</a> of the LaunchChecklist.
000:02:45|The CM has an Environmental Control System (ECS) cooling system using 2 glycol coolant loops. These are similar to those in a car engine; a glycol (antifreeze)/water mixture is pumped round a loop, collecting heat from the CM equipment and the crew spacesuits. It is then normally passed through radiators on the side of the SM, to cool it down by thermal radiation into space, before being pumped back into the CM. Until shortly before launch, the glycol is passed through refrigerators in the Launch Utility Tower to cool the spacecraft systems. Then, because the radiators are heated by friction with the atmosphere during ascent through the atmosphere, they are bypassed and the heat produced by the CM equipment and the crew is absorbed by the glycol and the pre-chilled structure. Once the spacecraft has reached an altitude of about 110,000 feet (30 kilometres), a secondary cooling system cuts in using the near vacuum to evaporate water, chilling the Evaporator. Glycol is then passed through the evaporator to cool it. Since the evaporator uses up water, the radiators are used in preference once the spacecraft is in orbit. At 000:02:45 Duke is supposed to have set 2 switches (Glycol Evaporator Steam Auto and Glycol Evaporator H<sub>2</sub>O Flow) to Auto in order to bring the evaporator on line. Mattingly is reminding him of this. Despite this, see 000:05:02
000:03:37|Throughout launch, P11 causes the the FDAI to display the difference between the launch vehicle attitude (controlled by the IU) and the nominal attitude calculated by the CMC. So long as the CMC and the IU are in agreement, the crew can be confident that the trajectory is good.
