001:38:14|The Lift-off + 8 PAD carries data for P37, a program in the computer that will calculate the details of a burn that will return the crew to Earth. An important condition for P37 is that the spacecraft must still be in Earth's sphere of influence, thus simplifying the calculations. The program takes the four values from the PAD; the specified time for ignition of the engine, a specified maximum change in velocity (or Delta-V), the longitude of the splashdown and the GET for the start of re-entry. These act as a set of constraints with which it calculates the desired trajectory and the details of the burn to achieve it.
001:38:30|And now the PAD for the TLI Burn itself.
001:38:40|The data read up by Fullerton is structurally different to other PADs as the manoeuvre is controlled by the IU on the launch vehicle, and not the computer in the CM. A form for filling in the numbers is available on <a href="https://history.nasa.gov/afj/ap16fj/csmlc/a16L2-21.gif" target="afj">L2-21</a>
001:38:40|<a name="tb6"></a>The timings for events relating to the launch vehicle are defined relative to a number of time bases, each of which start with a particular event. This allows controllers to move complete sequences of events relative to the overall mission time. The restart sequence for the S-IVB's single J-2 engine is tied to Time Base 6 (TB-6). When TB-6 begins, all subsequent events to restart the engine such as tank repressurisation, engine chilldown, ullage, etc., follow on, leading to the engine start command 9 minutes, 30 seconds later, and ignition 8 seconds after that.
002:23:57|The crew also have tasks to perform in the minutes leading up to the TLI burn and they use their event timer to help them. Around 002:23:57, the 'S-II Sep' lamp is illuminated for ten seconds, this being the start of TB-6. At 9 minutes to ignition, John will start the event timer counting up, having previously set it to 51:00. This will give a visual count-up to and beyond ignition to aid the crew in sequencing their final tasks before and during TLI. Items in the checklist are therefore shown with times from 51:00, through (1:)00:00 and upwards.
001:40:43|Ellington Air Force Base (now Ellington Field) is located approximately 24 km (15 miles) south of downtown Houston, near the major highway heading from the City to NASA and Galveston Island. It is where NASA bases its small fleet of aircraft in support of the Manned Spacecraft Centre.
001:41:45|At this point, the Command Module's computer, the CMC, must be set to receive the updated state vector. This involves setting the Up Telemetry (Tlm) switch to the right of the DSKY to Accept. The CMC must also be in an idle status (running P00, essentially a 'do-nothing' program). P00 is commonly pronounced 'pooh' by all the Apollo crews as in the character from A. A. Milne's book <em>Winnie the Pooh</em>. As recounted in Murray &amp; Cox's book, <em>Apollo: The Race to the Moon</em>, this program name even entered the daily lingo of the flight controllers. To 'go to poo' meant to go to sleep. While the CMC is receiving data link information by up-telemetry, the top left DSKY status light will illuminate.
001:42:08|Mission Control has some final updates to the procedures for TLI, starting on Page L2-28 of the Checklist.
001:42:28|And on Page <a href="https://history.nasa.gov/afj/ap16fj/csmlc/a16L2-29.gif" target="afj">L2-29</a>.
001:43:33|With the state vector updated, the CMC Up Tlm switch is set to block further data from the ground
002:13:46|See explanation of the SECS Pyros at <a style="color: rgb(0, 0, 102);" href="#002_13_46">002:13:46</a>
001:50:05|Break in Tech transcript until reacquisition by Canary at 001 50 05. Onboard tape restarts one minute after Loss Of Signal.
001:49:50|Towards the end of the TLI burn, the S-IVB's thrust will actually produce an acceleration of nearly 1.4g, so all the items in the CM have to be properly secured.
001:50:00|If the attitude of the spacecraft changes, there could be a small amount of lateral acceleration. Placing heavy objects on the spacecraft's shelf under the side windows would not be a good location.
001:50:39|The technical transcript and the CM tape transcripts do not agree for the period 001 50:39 to 001:50:52. The technical transcript gives continued conversation between Charlie Duke and Gordon Fullerton, lasting up until 001:54:23, about 30 seconds before <a target="_new" href="acron.html#los">LOS</a>. The CM transcript details a conversation between all three crew members, but this does not fit in with the other conversation. It appears that the CM transcript timings may be in error. The following details both conversations in turn.
001:54:21|The suspect CM tape follows. The two tapes agree again from 001:54:21.
001:54:21|No more CM tape data recorded until 001:54:21
001:54:23|<img style="width: 470px; height: 281px;" alt="Aria" src="pics/aria.jpg" align="right">The Apollo Range Instrumentation Aircraft or ARIA are US Air Force Boeing EC-135E aircraft modified from C-135B transports similar to the Boeing 707 airliner. With a huge tracking antennae in the bulbous nose, the ARIA provides a mobile "ground" station where the Manned Spaceflight Network cannot provide communications. Four of these aircraft were converted at the time of Apollo.
001:54:33|The CM tape transcript ascribes this to Ken Mattingly.
001:54:54|The crew are now starting to prepare the spacecraft for Trans Lunar Injection, starting at the top of <a href="https://history.nasa.gov/afj/ap16fj/csmlc/a16L2-27.gif" target="afj">Page 2-27</a> of the Launch Checklist.
001:55:17|Setting the Trans Lunar Inject (XLunar) switch on the MDC to tells the Instrument Unit that the crew are ready for TLI. At 42 seconds into TB-6 the IU will make the first of two checks to see the status of this switch.
001:55:24|The Launch Vehicle Emergency Detection System is powered up so that any failures in the S-IVB during the burn can be indicated to the crew. At this stage in the flight, there is no automatic abort option, so the crew would have to manually initiate separation of the CSM from the S-IVB
001:55:26|The Entry Monitoring System provides a secondary function of measuring velocity changes during the TLI burn and later SPS and RCS burns. During Entry, the output of the EMS's accelerometer is integrated twice to calculate the distance travelled by the CM after the entry interface. During engine burns, the accelerometer output is integrated once to calculate the velocity change (Delta-V) along the CM's X-axis. The electro-luminescent indicator can read up to 99,999.9 feet per second, with a precision of 0.1 foot per second. In each case, the crew set the desired Delta-V on the counter, which then counts down to zero.
001:55:26|The use of the EMS is a good example of system redundancy in the Apollo design. Changes in spacecraft velocity could be measured from the main CM Guidance and Nav inertial system, but this is more complex and liable to errors due to drift. The fixed EMS accelerometer provides a simple, reliable means of making this critical measurement. As another example of multiple use of the same system, the EMS display also provides an indication of the range between the CM and the LM during rendezvous operations, using the separate VHF radio ranging system.
001:55:26|The EMS Delta-V Test and Null Bias Check is carried out in accordance with <a href="https://history.nasa.gov/afj/ap16fj/csmgc/2-5.gif" target="afj">Page G2-5</a> of the G&amp;C Checklist.
001:55:42|This value is set as part of the test; it is not related to the earlier PAD values.
001:55:51|While John Young carries on with the EMS test, Charlie Duke and Ken Mattingly ready the <a href="https://history.nasa.gov/afj/ap16fj/acron.html#cmc" target="afj">CMC</a> for TLI using P15. This provides a back-up for initiation of the S-IVB ignition sequence, monitors the TLI burn if the IU is in control and provides automatic shutdown of the S-IVB if the CMC is in control.
001:56:35|Charlie Duke is reading the TLI PAD details to Ken Mattingly, who is then entering them in the DSKY. The first set of figures is the GET of Time Base 6, 2:23:57.
001:56:39|The target is between -0.1 and -41.5 feet per second, so the actual value is right in the middle of the range.
001:57:08|Verb 06 Noun 14 is the command to load the velocity change.
001:57:17|Not clear what John Young is referring to.
001:57:43|From the TLI PAD, the Indicated Velocity at S-IVB cut-off will be 35,589 feet per second (10,848 m/s).
001:59:14|From the TLI PAD, the change in velocity during the burn will be 10,373.0 feet per second (3,161.7 m/s).
002:00:12|John Young and Charlie Duke continue with the P15.
002:02:43|The crew are halfway down Page 2-27 of the Launch Checklist. However, they have become slightly out of order, and have carried out P15 without having carried out Verb 83. If they now call up the Verb 83 routine, they will lose the information they have stored in the CMC ready for the TLI burn. Without Verb 83, they will not have an exact pitch angle when they reset the ORDEAL.
002:02:51|Applying power to the two Translational Controllers mounted on John Young's and Ken Mattingly's couch arms.
002:03:00|Applying power to the two Rotational Controllers mounted on John Young's and Ken Mattingly's couch arms. There are two supplies; the Normal supply powers the breakout switches which control the <a href="https://history.nasa.gov/afj/ap16fj/acron.html#rcs" target="afj">RCS</a> through the <a href="https://history.nasa.gov/afj/ap16fj/acron.html#SCS" target="afj">SCS</a> and the <a href="https://history.nasa.gov/afj/ap16fj/acron.html#cmc" target="afj">CMC</a>. The Direct supply powers the direct switches which give the crew direct control of the RCS thrusters in event of a malfunction of the SCS. A more detailed description of the RCS and its controls will be given in the chapter on <a href="https://history.nasa.gov/afj/ap16fj/acron.html#tde" target="afj">TD&amp;E</a>.
002:03:09|Enabling SCS control through Translation and Rotation Controls.
000:06:02|Setting the dual indicator to monitor S-IVB oxidiser pressure. See <a href="https://history.nasa.gov/afj/ap16fj/01_Day1_Pt1.html#0000602" target="afj">000:06:02</a> for more details.
002:03:17|The term "ullage" comes from the brewing industry, where it means the space above the beer in a brewer's vat., but in this context it means the volume in the spacecraft propellant tanks that is filled with helium gas. In a spacecraft, fuel will float freely in the tanks, unless it is constrained. However, it is essential that there are no bubbles of helium in the propellant before it is fed into the engines. In smaller tanks, such as those of the RCS, Teflon bladders are used to control the fuel and to separate it from the helium used to pressurise the tanks. But in larger tanks, such as the four main ones of the SPS, bladders cannot be used and so a short period of acceleration is required to force the fuel to the bottom of the tank (and the helium to the top) before the SPS fires. This acceleration is provided by the RCS firing for a few seconds. Normally, the SPS will command this automatically, but in event of a failure of the automatic system, the Direct Ullage switch on Panel 1 of the MDC provides a back-up capability for initiating the RCS ullage burn. The Direct Ullage Switch is backed up by two circuit breakers on Panel 8, which must be energised to enable the switch to work. A complex system, but necessary to provide the necessary safety.
002:03:17|It is not clear what the next conversation is about. John Young and Ken Mattingly seem to be discussing a deviation from the procedure. Possibly linked to the Verb 83 issue?
001:42:12|The crew have now completed <a href="https://history.nasa.gov/afj/ap16fj/csmlc/a16L2-28.gif" target="afj">Page L2-28</a> of the Launch Checklist. Charlie Duke is highlighting the change in FDAI slew setting on <a href="https://history.nasa.gov/afj/ap16fj/csmlc/a16L2-29.gif" target="afj">Page L2-29</a> that was read up from Mission Control at 001:42:12
002:09:35|This may be a transcription error. The time for R2 ignition in the R2 ignition in the TLI PAD is 107.2, and John Young may be referring to this as "ten, seven, two".
002:09:57|John Young is reviewing the procedures on <a href="https://history.nasa.gov/afj/ap16fj/csmlc/a16L2-28.gif" target="afj">Page L2-28</a>. During the S-IVB re-start sequence, the booster propellant tanks are pressurised. Because the tanks share a common bulkhead, any large difference in pressure could cause a catastrophic failure of the bulkhead, followed by an explosion of the booster. If the LOX pressure exceeds the LH<sub>2</sub> pressure by more than 36 psi, the LH<sub>2</sub> pressure exceeds the LOX pressure by more than 26 psi or the LOX tank pressure exceeds 50 psi, then the crew must carry out an emergency separation of the CSM from the S-IVB, as detailed on <a href="https://history.nasa.gov/afj/ap16fj/csmlc/a16Lemer1-1.gif" target="afj">Page Emer 1-1</a>.
002:12:09|And back to more housekeeping, preparing the cabin for acceleration.
002:13:46|A number of the major systems on Apollo are operated by explosives. This provides a very reliable and low-weight means of achieving events such as separating the LM from the S-IVB, or of separating the docking ring from the CM to jettison the LM after docking in lunar orbit. As a down-side, they are one-shot devices that cannot be re-set if operated in error. With the SECS Pyro Arm circuit breakers live, all the relevant switches are also live. John Young is making sure that all the crew are aware of this, since even though the switches are guarded, it would be all too easy to press the wrong one and, for example, jettison the docking ring while leaving the LM attached to the S-IVB - thus losing any chance of a lunar landing. The two controls, although not adjacent, are on the same row of six switches. The even more important switches that jettison the SM from the CM are powered by different circuit breakers and are not live at this point.
002:13:46|A similar problem, but with even more serious potential consequences, faced the crew of Apollo 13 as they approached the Earth at the end of their calamitous mission. They had to jettison the SM from the CM, while keeping the LM attached until the last minute. The CMP, Jack Swigert, had to resort to sticking large labels on the two switches to make sure that he did not press the wrong one.
002:14:07|Ken Mattingly is referring to his life jacket.
002:14:24|Not clear what the discussion is about. Pro (Proceed) is normally the end of a CMC Program, so the crew may have not completed P15.
002:15:08|In zero gravity, the body has a natural tendancy to move its's fluids to the head, since the normal counterbalancing effect of gravity is removed. The sinuses also tend to fill, both due to increased leakage of fluid into them and because they do not drain normally. The result is a full-headed feeling and a swelling of the face.
002:16:10|Although the Launch Checklist shows the periods that the spacecraft will be in contact with the ground stations, it does not include the same for the ARIA.
002:17:19|In other words, the CM will separate from the S-IVB.
002:18:47|Five minutes to Time Base 6 start.
001:54:54|The crew are re-reading the checklist. Having bypassed some of the steps in the TLI preparation on Page <a href="https://history.nasa.gov/afj/ap16fj/csmlc/a16L2-27.gif" target="afj">L2-27</a>, they are now checking that nothing has been omitted in their earlier actions from <a href="https://history.nasa.gov/afj/ap16fj/#001_54_54" target="afj">001:54:54</a>.
002:02:55|The <a href="https://history.nasa.gov/afj/ap16fj/acron.html#secs" target="afj">SECS</a> Pyro switches are being selected, as this step was bypassed at <a href="https://history.nasa.gov/afj/ap16fj/#002_02_55" target="afj">002:02:55</a>.
001:55:17|See comment at <a href="https://history.nasa.gov/afj/ap16fj/#001_55_17" target="afj">001:55:17</a> on the significance of the Translunar Inject (XLunar) switch
002:21:17|John Young is setting the ORDEAL to 300 and Lunar, in accordance with the Launch Checklist Page L2-28.
002:22:50|The crew are waiting for the Uplink Activity Light to go On, signalling the start of Time-Base 6, nine minutes and 38 seconds before ignition (9:30 before Engine Start Command).
002:24:45|The S-II SEP light is now being used as an indicator.
002:24:54|The FDAI needs to be slewed to the correct position.
002:25:44|Setting the ORDEAL. See earlier for the ORDEAL controls.
002:26:04|Break in CM Tape, perhaps due to <a href="https://history.nasa.gov/afj/ap16fj/acron.html#vox" target="afj">vox</a>.
002:31:16|One minute, 15 seconds to S-IVB ignition.
002:31:30|On Launch Checklist Page L2-29, coming up for 58:15, 105 seconds to S-IVB ignition.
002:31:57|The DSKY display blanks for five seconds at 105 seconds before S-IVB ignition, while in P15.
001:41:45|To ensure that there is a record of spacecraft systems performance, even if the data link with Mission Control is lost during the TLI burn, Charlie Duke sets the Data Recorder Reproducer (DRR) - the CM's tape recorder - to High pulse-code modulation (or data bit rate), to Record and to Forward, to achieve the best recording conditions. He also resets the Up-Data Link equipment, and then sets it to Normal, in case Mission Control need to up-link any commands to the spacecraft. However, the crew still have the final control over up-link activity as the Up-Tlm switch is set to Block (see <a href="https://history.nasa.gov/afj/ap16fj/#001_41_45" target="afj">001:41:45</a>).
001:55:26|John Young sets the EMS to display the velocity change during the burn, as discussed at <a href="https://history.nasa.gov/afj/ap16fj/#001_55_26" target="afj">001:55:26</a>
001:55:26|The S-II Sep light illuminates at Time Base 6, 58:36, two seconds before S-IVB APS starts thrusting in the ullage manoeuvre.
002:32:59|The spacecraft is over the Pacific, facing into the sunrise. Ken Mattingly is suggesting that John Young increase the brightness of the displays to help him read them
002:50:29|The engine start command is sent at 002:50:29.51 GET. The restart sequence is essentially identical to the start of the S-II stage's <a href="https://history.nasa.gov/afj/ap16fj/01_Day1_Pt1.html#j2start" target="new" target="afj">J-2s</a> and of the first start of the S-IVB 's J2. The main difference is that fuel is allowed to run through the engine walls for eight seconds before the final ignition.
002:09:57|See comments at <a href="https://history.nasa.gov/afj/ap16fj/#002_09_57" target="afj">002:09:57</a>.
002:38:45|Mission Control cannot directly observe the vibration levels that the crew are sensing.
002:38:45|According to the AS-511 Flight Evaluation Report, "In a post-mission debriefing the Apollo 16 crew reported that the vehicle had experienced some low amplitude vibration or “buzz” during portions of the S-II stage burn, and throughout the S-IVB first and second burns. The crew also noted that the vibrations did not appear to be oriented in any particular axis. Analysis of flight data indicates the presence of low amplitude, approximately 65 hertz, vibration during the S-II stage burn and both S-IVB stage burns. The data show lateral amplitudes of ±0.10 g at the IU during S-IVB first burn and ±0.20 during second burn. The vibrations can also be seen on selected propulsion pressure measurements. A review of AS-510 [Apollo 15] data shows similar vibration at approximately 72 hertz. Because of the data characteristics, the vibration is suspected to be related to normal stage propulsion system operation and probably characteristic of the J-2 turbomachinery. These vibrations pose no pogo or any other structural concerns, and are of such low amplitude as to be virtually obscured in the measurement background noise." A rather bland engineering report on a phenomenon that gave the crew considerable concern!
002:39:31|According to the AS511 Flight Evaluation Report, "The S-IVB second burn time was 341.9 seconds, 2.4 seconds less than predicted. This difference is primarily due to the slightly higher S-IVB performance and lighter vehicle mass during the second burn". The lighter vehicle mass was due, in part, to a slightly longer (0.4 seconds) than anticipated first S-IVB burn, due in turn to lower than anticipated S-IC and S-II performance.
002:40:28|The crew are now at the top of Page L2-31, as they reconfigure the spacecraft after the successful TLI burn.
002:41:57|The CMC is now in P00, to update the State Vector.
002:43:31|Verb 66 sets the updated CMC State Vector into the LM Computer.
|Apollo 16 has completed the Trans Lunar Injection burn (TLI) of the S-IVB third stage of the Saturn V booster. The S-IVB now holds only 2.75 tonnes of the 108.45 tonnes of propellant that it was launched with, the balance having been consumed to place the stage and the attached Apollo spacecraft on the long, three day ballistic coast to the Moon. The 40 metre long, 65 tonne "stack" of booster and spacecraft is travelling at 36,360 kilometres per hour, but is slowing down rapidly since it is still subject to approximately one quarter of Earth's surface gravity. It will continue to slow down until the Moon's gravitational pull exceeds that of the Earth, in about two days time.
|Inside the Command Module, John Young, Ken Mattingly and Charlie Duke are continuing to prepare to separate the Command and Service Modules (CSM) from the conical shroud known as the SLA, in 20 minutes time. (NASA sources of the time give varying meanings for this acronym; either Service Module/Lunar Module Adapter as in the Flight Plan or, more commonly, Spacecraft/Lunar Module Adapter.) This will then allow them to turn the CSM around, dock with the Lunar Module (LM) and extract it from the SLA. This is referred to as Transposition, Docking and Extraction (TD&amp;E)
003:03:09|At present, the on-board tape recorder is not selected on, so there is no transcript of the crew's discussions. The CM transcript will start at <a href="https://history.nasa.gov/afj/ap16fj/#003_03_09" target="afj">003:03:09</a>, two minutes before separation. For now, we can only follow the crew's communications with Mission Control, where the CapCom is Gordon Fullerton, just as it has been through launch, Earth orbit and the TLI burn.
001:29:49|See 001:29:49 for a description of the four omni-directional S-Band antennae the crew are using to maintain communication with Mission Control.
002:41:50|After the TLI burn, at 002:41:50, the S-IVB and attached Apollo spacecraft was manoeuvred to the in-plane local horizontal. This involved a -25 degree pitch (down), and minus 1 degree yaw (left).Now, at 002:54:19, the stack is being commanded to manouevre +120 degrees (up), -40 degrees (yaw) and -180 degrees in roll. This will give the crew the optimum lighting conditions for the TD&amp;E.
002:55:12|In Mission Control, the EECOM is monitoring the cabin pressure, which has now reached the target of 5.7 pounds per square inch, gauge [39.3 kPa]. The crew will now close the Direct O<sub>2</sub> valve.
002:59:23|The S-IVB has completed its manoeuvre to the TD&amp;E attitude.
003:03:04|CM Transcript starts. The crew are on AOH Page 4-322, working through the TD&amp;E checklist.
003:05:00|<a name="csmslasep"></a>Separation of the CSM from the SLA is a fast but complex event. A train of explosive cords sever electrical connections between the Service Module and the S-IVB; they cut the metal structure joining the SM to the SLA to allow the spacecraft to come free; they cut the upper 75% of the conical SLA into four long sections which are now only joined to the S-IVB by spring loaded partial hinges at the centre of their lower edge; they set off pyrotechnic thrusters, mounted within the intact portion of the SLA, which force pistons to push on the outside edge of each SLA panel, causing them to begin rotating away from the enclosed Lunar Module. Once the panels have rotated about 45° from the centreline of the launch vehicle, the hinges disengage, allowing the springs within the hinge assembly to push the panels away at about 2.5 m/s, leaving the LM exposed on top of the Saturn's third stage.(A15FJ)
003:05:17|The crew are now working through Serial 5, placing the CSM in required post-separation configuration (AOH Vol 2 Page 4-325)
003:05:19|Checking that all SM RCS propellant valves and helium supply valves are closed.
003:16:13|End of CM transcript until 003:16:13
003:16:13|CM transcript restarts
003:25:07|CM Transcript ends.
003:50:15|CM Transcript restarts.
008:00:58|Break in CM Transcript until 008 00 58
004:39:52|Break in CM transcript until 004 39 52
006:05:55|At this point there is a shift change in Mission Control, with the Orange Team under Pete Frank taking over control. The new CapCom is Donald Peterson. "Pete" Peterson joined the astronaut corps in 1969, but did not fly until the sixth Shuttle mission in 1983.
008:00:58|CM Tape transcript restarts at 008 00 58
014:02:34|Shift Change
024:57:47|End of CM tape
030:33:12|CM Tape starts
034:02:11|Timings and speakers differ in next section between the CM and technical tape transcriptions
034:02:56|Break in CM transcript.
034:07:27|End of CM tape for Day 2.
074:22:33|Break in CM tape to 074 22 33
074:34:46|Apollo 16 is now in Lunar orbit, starting Rev 1
075:27:43|Break in CM tape until 075 27 43
076:17:54|End of CM ttranscript until 076 17 54
076:13:01|Loss of Signal
076:39:39|Beginning Lunar Rev 2 at 076 40
076:56:01|A search of Lunar atlases cannot locate a feature called Thesaur. However, the track of Apollo 16 puts it to the north of Pasteur at this time. It seems likely that this is a mis-transcription. The following references to Thesaur have been amended to Pasteur.
077:12:46|Break in CM tape to 077 12 46
078:35:38|Cease CM transcript
080:41:47|Begin Lunar Rev 4 at 080 42
